	date	likes	retweets	text
297	Tue Feb 20 13:11:58 +0000 2018	79252	20233	Hope Republicans in the Great State of Pennsylvania challenge the new “pushed” Congressional Map, all the way to th… https://t.co/bT190oQKpM
298	Tue Feb 20 13:03:53 +0000 2018	51748	10184	Matt Schlapp and CPAC are getting ready for another exciting event. Big difference from those days when President O… https://t.co/KxKVJL0Bc4
299	Tue Feb 20 12:54:39 +0000 2018	82125	17172	Republicans are now leading the Generic Poll, perhaps because of the popular Tax Cuts which the Dems want to take a… https://t.co/TQfyR96KP8
300	Tue Feb 20 12:46:18 +0000 2018	85420	20702	....The President Obama quote just before election. That’s because he thought Crooked Hillary was going to win and… https://t.co/59Wli8q1pN
301	Tue Feb 20 12:37:20 +0000 2018	67898	17422	“There is no serious person out there who would suggest somehow that you could even rig America’s elections, there’… https://t.co/eJ9M6A2H50
302	Tue Feb 20 12:24:54 +0000 2018	66432	14654	Thank you to @foxandfriends for the great timeline on all of the failures the Obama Administration had against Russ… https://t.co/SI7CxX4a7C
303	Tue Feb 20 02:48:02 +0000 2018	68319	13276	“The Faith of Donald Trump,” a book just out by David Brody and Scott Lamb, is a very interesting read. Enjoy!
304	Tue Feb 20 02:29:29 +0000 2018	120755	25324	The U.S. economy is looking very good, in my opinion, even better than anticipated. Companies are pouring back into… https://t.co/Sxweprvk7N
305	Tue Feb 20 02:21:08 +0000 2018	55067	9397	.@MittRomney has announced he is running for the Senate from the wonderful State of Utah. He will make a great Sena… https://t.co/h1RaVb2OVj
306	Mon Feb 19 19:55:49 +0000 2018	91476	22304	Obama was President up to, and beyond, the 2016 Election. So why didn’t he do something about Russian meddling?
307	Mon Feb 19 13:42:10 +0000 2018	144383	23900	Have a great, but very reflective, President’s Day!
308	Mon Feb 19 04:28:40 +0000 2018	153807	34483	Just watched a very insecure Oprah Winfrey, who at one point I knew very well, interview a panel of people on 60 Mi… https://t.co/7iuf59562i
309	Sun Feb 18 19:13:02 +0000 2018	102198	15555	My great friends from NASCAR are having their big race today, The Daytona 500. Brian France and the France family a… https://t.co/EWBOQxPW2S
310	Sun Feb 18 17:10:32 +0000 2018	77569	17989	Thank you to KenStarr, former Independent Counsel, Whitewater, for your insight and powerful words on FISA abuse, R… https://t.co/XGIgUkn3qK
311	Sun Feb 18 13:55:55 +0000 2018	97307	21876	Great Pollster John McLaughlin now has the GOP up in the Generic Congressional Ballot. Big gain over last 4 weeks.… https://t.co/iIrNmfPgbQ
312	Sun Feb 18 13:46:39 +0000 2018	76978	19659	The Fake News of big ratings loser CNN. https://t.co/rYsv90cnvs
313	Sun Feb 18 13:11:28 +0000 2018	118421	33032	If it was the GOAL of Russia to create discord, disruption and chaos within the U.S. then, with all of the Committe… https://t.co/fx3CPabzTi
314	Sun Feb 18 12:53:11 +0000 2018	0	12885	RT @mike_pence: Big night. Largest-ever Dallas County GOP Reagan Day Dinner. As I told the crowd, under President @realDonaldTrump: Promise…
315	Sun Feb 18 12:43:48 +0000 2018	90272	19754	Now that Adam Schiff is starting to blame President Obama for Russian meddling in the election, he is probably doin… https://t.co/R2OTHSUYP9
316	Sun Feb 18 12:33:16 +0000 2018	127302	31782	I never said Russia did not meddle in the election, I said “it may be Russia, or China or another country or group,… https://t.co/1dMjQbLlSC
317	Sun Feb 18 12:22:29 +0000 2018	108800	28427	Finally, Liddle’ Adam Schiff, the leakin’ monster of no control, is now blaming the Obama Administration for Russia… https://t.co/9HNsbaWwWj
318	Sun Feb 18 12:02:52 +0000 2018	124808	38409	Never gotten over the fact that Obama was able to send $1.7 Billion Dollars in CASH to Iran and nobody in Congress,… https://t.co/5nQ35ANIrg
319	Sun Feb 18 04:22:48 +0000 2018	96855	27064	General McMaster forgot to say that the results of the 2016 election were not impacted or changed by the Russians a… https://t.co/ilaHKwf6Jy
320	Sun Feb 18 04:08:45 +0000 2018	149251	37061	Very sad that the FBI missed all of the many signals sent out by the Florida school shooter. This is not acceptable… https://t.co/yvvTEmad2e
321	Sat Feb 17 23:45:28 +0000 2018	123101	32223	Just like they don’t want to solve the DACA problem, why didn’t the Democrats pass gun control legislation when the… https://t.co/c2gS0ByFUw
322	Sat Feb 17 20:16:39 +0000 2018	58470	17147	“I have seen all of the Russian ads and I can say very definitively that swaying the election was *NOT* the main go… https://t.co/y4PVZ6KZqv
323	Sat Feb 17 20:11:32 +0000 2018	60871	18781	The Fake News Media never fails. Hard to ignore this fact from the Vice President of Facebook Ads, Rob Goldman! https://t.co/XGC7ynZwYJ
324	Sat Feb 17 19:46:48 +0000 2018	106020	25549	Funny how the Fake News Media doesn’t want to say that the Russian group was formed in 2014, long before my run for… https://t.co/9BPo5EB5WN
325	Sat Feb 17 19:36:14 +0000 2018	90426	21877	Deputy A.G. Rod Rosenstein stated at the News Conference: “There is no allegation in the indictment that any Americ… https://t.co/pPhsPl34Ie
326	Sat Feb 17 19:26:13 +0000 2018	71345	18899	“Charges Deal Don A Big Win,” written by Michael Goodwin of the @nypost, succinctly states that “the Russians had n… https://t.co/yoFUA9PolC
327	Sat Feb 17 19:04:43 +0000 2018	97227	14749	Melania and I met such incredible people last night in Broward County, Florida. Will never forget them, or the evening!
328	Sat Feb 17 04:53:13 +0000 2018	118245	24727	Our entire Nation, w/one heavy heart, continues to pray for the victims &amp; their families in Parkland, FL. To teache… https://t.co/jR8THlLD5z
329	Fri Feb 16 20:18:11 +0000 2018	141448	37076	Russia started their anti-US campaign in 2014, long before I announced that I would run for President. The results… https://t.co/B4D7ZcKHPp
330	Fri Feb 16 14:49:54 +0000 2018	97344	21914	Cannot believe how BADLY DACA recipients have been treated by the Democrats...totally abandoned! Republicans are still working hard.
331	Fri Feb 16 14:37:56 +0000 2018	120168	19859	I will be leaving for Florida today to meet with some of the bravest people on earth - but people whose lives have… https://t.co/1APUFLwj1f
332	Thu Feb 15 20:19:11 +0000 2018	62036	13606	Presidential Proclamation Honoring the Victims of the Tragedy in Parkland, Florida: https://t.co/RTQWAKiSnR https://t.co/Nhs32bm5zB
333	Thu Feb 15 19:26:09 +0000 2018	60256	15264	...lottery, continues deadly catch-and-release, and bars enforcement even for FUTURE illegal immigrants. Voting for… https://t.co/ruP4vp9vxa
334	Thu Feb 15 19:25:23 +0000 2018	72393	20041	The Schumer-Rounds-Collins immigration bill would be a total catastrophe. @DHSgov says it would be “the end of immi… https://t.co/FegRjpmNZj
335	Thu Feb 15 19:22:16 +0000 2018	0	8005	RT @SpoxDHS: Schumer-Rounds-Collins destroys the ability of @DHSgov to enforce immigration laws, creating a mass amnesty for over 10 millio…
336	Thu Feb 15 17:33:41 +0000 2018	82660	19701	In times of tragedy, the bonds that sustain us are those of family, faith, community, and country. These bonds are… https://t.co/LraxXxUN3D
337	Thu Feb 15 14:57:21 +0000 2018	101069	20653	While the Republicans and Democrats in Congress are working hard to come up with a solution to DACA, they should be… https://t.co/qti7gQGh0I
338	Thu Feb 15 12:12:41 +0000 2018	89152	20794	So many signs that the Florida shooter was mentally disturbed, even expelled from school for bad and erratic behavi… https://t.co/3mSYrtTng6
339	Wed Feb 14 20:55:01 +0000 2018	111153	19320	Just spoke to Governor Rick Scott. We are working closely with law enforcement on the terrible Florida school shooting.
340	Wed Feb 14 20:50:11 +0000 2018	173172	39192	My prayers and condolences to the families of the victims of the terrible Florida shooting. No child, teacher or an… https://t.co/RFJxgM1jhm
341	Wed Feb 14 19:11:32 +0000 2018	56246	11312	Today, I was honored to be joined by Republicans and Democrats from both the House and Senate, as well as members o… https://t.co/38kUIIV8Cp
342	Wed Feb 14 18:15:12 +0000 2018	65272	14918	As we come together to celebrate the extraordinary contributions of African-Americans to our nation, our thoughts t… https://t.co/SwAJxO88zC
343	Tue Feb 13 10:52:47 +0000 2018	106570	22413	Negotiations on DACA have begun. Republicans want to make a deal and Democrats say they want to make a deal. Wouldn… https://t.co/YW4mCpHr0R
344	Tue Feb 13 10:43:22 +0000 2018	105362	22693	Our infrastructure plan has been put forward and has received great reviews by everyone except, of course, the Demo… https://t.co/2EfB9sObdN
345	Mon Feb 12 20:48:16 +0000 2018	67363	14229	The journey to #MAGA began @CPAC 2011 and the opportunity to reconnect with friends and supporters is something I l… https://t.co/DSz3Szp4xE
346	Mon Feb 12 12:54:32 +0000 2018	86502	16672	Thank you to Sue Kruczek, who lost her wonderful and talented son Nick to the Opioid scourge, for your kind words w… https://t.co/0kIdepXBdi
347	Mon Feb 12 12:46:56 +0000 2018	138417	30081	This will be a big week for Infrastructure. After so stupidly spending $7 trillion in the Middle East, it is now ti… https://t.co/OcX7UN18Er
348	Sun Feb 11 20:36:08 +0000 2018	77265	14813	Just spoke to @JohnKasich to express condolences and prayers to all for the horrible shooting of two great police o… https://t.co/X7AhuEYwHI
349	Sun Feb 11 20:26:03 +0000 2018	96894	23903	Rep. Lou Barletta, a Great Republican from Pennsylvania who was one of my very earliest supporters, will make a FAN… https://t.co/dA2lK3WHFU
350	Sun Feb 11 19:15:32 +0000 2018	124289	24831	4.2 million hard working Americans have already received a large Bonus and/or Pay Increase because of our recently… https://t.co/oJl5AiCPZs
351	Sun Feb 11 18:21:48 +0000 2018	122941	30725	So many positive things going on for the U.S.A. and the Fake News Media just doesn’t want to go there. Same negativ… https://t.co/LBnzRfAkJx
352	Sat Feb 10 23:34:08 +0000 2018	118430	31688	My Administration has identified three major priorities for creating a safe, modern and lawful immigration system:… https://t.co/DrjXUak41S
353	Sat Feb 10 21:18:23 +0000 2018	84491	20311	My thoughts and prayers are with the two police officers, their families, and everybody at the @WestervillePD. https://t.co/AoingY77Ky
354	Sat Feb 10 18:50:02 +0000 2018	117403	30212	Republicans want to fix DACA far more than the Democrats do. The Dems had all three branches of government back in… https://t.co/0Or3U2CFZR
355	Sat Feb 10 18:34:49 +0000 2018	75300	19735	....agencies, not just the FBI &amp; DOJ, now the State Department to dig up dirt on him in the days leading up to the… https://t.co/Of9d7fmsA3
356	Sat Feb 10 18:16:20 +0000 2018	100793	25540	“My view is that not only has Trump been vindicated in the last several weeks about the mishandling of the Dossier… https://t.co/dWJuKECfwn
357	Sat Feb 10 15:33:35 +0000 2018	135814	36911	Peoples lives are being shattered and destroyed by a mere allegation. Some are true and some are false. Some are ol… https://t.co/6Zz5RAeoQe
358	Sat Feb 10 15:20:05 +0000 2018	104829	32446	According to the @nytimes, a Russian sold phony secrets on “Trump” to the U.S. Asking price was $10 million, brough… https://t.co/CBMaAX5VMt
359	Sat Feb 10 14:20:35 +0000 2018	116735	31948	The Democrats sent a very political and long response memo which they knew, because of sources and methods (and mor… https://t.co/iR1265rmh3
360	Sat Feb 10 14:02:54 +0000 2018	64569	13702	Jobless claims have dropped to a 45 year low!
361	Fri Feb 09 13:59:13 +0000 2018	89027	21253	Costs on non-military lines will never come down if we do not elect more Republicans in the 2018 Election, and beyo… https://t.co/WgvQYGEaMu
362	Fri Feb 09 13:47:28 +0000 2018	109978	28024	Without more Republicans in Congress, we were forced to increase spending on things we do not like or want in order… https://t.co/7dfsJYWjRY
363	Fri Feb 09 13:39:15 +0000 2018	129810	27021	Just signed Bill. Our Military will now be stronger than ever before. We love and need our Military and gave them e… https://t.co/9MtCabhzj8
364	Fri Feb 09 03:22:53 +0000 2018	126608	39441	Wow! -Senator Mark Warner got caught having extensive contact with a lobbyist for a Russian oligarch. Warner did no… https://t.co/N5SoaLnllm
365	Thu Feb 08 23:26:22 +0000 2018	96953	23831	Time to end the visa lottery. Congress must secure the immigration system and protect Americans. https://t.co/yukxm48x9X
366	Thu Feb 08 20:10:58 +0000 2018	109833	30655	As long as we open our eyes to God’s grace - and open our hearts to God’s love - then America will forever be the l… https://t.co/wGUIaD1JX6
367	Thu Feb 08 18:44:00 +0000 2018	79544	13497	I will be meeting with Henry Kissinger at 1:45pm. Will be discussing North Korea, China and the Middle East.
368	Thu Feb 08 17:13:13 +0000 2018	106699	29282	Our founders invoked our Creator four times in the Declaration of Independence. Our currency declares “IN GOD WE TR… https://t.co/q8ib233y1M
369	Thu Feb 08 11:08:39 +0000 2018	105590	17654	Will be heading over shortly to make remarks at The National Prayer Breakfast in Washington. Great religious and po… https://t.co/bEReTLNLo4
370	Wed Feb 07 22:36:15 +0000 2018	108743	22962	The Budget Agreement today is so important for our great Military. It ends the dangerous sequester and gives Secret… https://t.co/VRkKsNDZGC
371	Wed Feb 07 22:13:16 +0000 2018	70212	13210	Congratulations to the Republic of Korea on what will be a MAGNIFICENT Winter Olympics! What the South Korean peopl… https://t.co/gGaZUnZBMa
372	Wed Feb 07 18:01:05 +0000 2018	65131	12669	Best wishes to the Republic of Korea on hosting the @Olympics! What a wonderful opportunity to show everyone that y… https://t.co/NL6cIfHZgN
373	Wed Feb 07 16:10:00 +0000 2018	136555	39119	NEW FBI TEXTS ARE BOMBSHELLS!
374	Wed Feb 07 14:59:49 +0000 2018	111852	21750	In the “old days,” when good news was reported, the Stock Market would go up. Today, when good news is reported, th… https://t.co/mW5vEWhZYY
375	Wed Feb 07 03:05:45 +0000 2018	166510	31328	Congratulations @ElonMusk and @SpaceX on the successful #FalconHeavy launch. This achievement, along with @NASA’s c… https://t.co/MaQocjQKcI
376	Wed Feb 07 00:48:01 +0000 2018	180479	32653	HAPPY BIRTHDAY to our 40th President of the United States of America, Ronald Reagan! https://t.co/JtEglBhm4c
377	Tue Feb 06 22:45:50 +0000 2018	75619	18198	Today, we heard the experiences of law enforcement professionals and community leaders working to combat the threat… https://t.co/BAHG9Ajkio
378	Tue Feb 06 16:05:42 +0000 2018	91958	25331	We need a 21st century MERIT-BASED immigration system.  Chain migration and the visa lottery are outdated programs… https://t.co/5SzmbuLXuY
379	Tue Feb 06 16:00:43 +0000 2018	89047	23382	Polling shows nearly 7 in 10 Americans support an immigration reform package that includes DACA, fully secures the… https://t.co/OD93mZebu7
380	Tue Feb 06 13:37:00 +0000 2018	103878	20680	My prayers and best wishes are with the family of Edwin Jackson, a wonderful young man whose life was so senselessly taken. @Colts
381	Tue Feb 06 13:32:57 +0000 2018	141751	35615	So disgraceful that a person illegally in our country killed @Colts linebacker Edwin Jackson. This is just one of m… https://t.co/r8vqtb4Tjb
382	Mon Feb 05 20:42:01 +0000 2018	105217	22632	Thanks to the historic TAX CUTS that I signed into law, your paychecks are going way UP, your taxes are going way D… https://t.co/DKVuox1qa6
383	Mon Feb 05 15:08:51 +0000 2018	132422	35275	Representative Devin Nunes, a man of tremendous courage and grit, may someday be recognized as a Great American Her… https://t.co/p7egMdnqQs
384	Mon Feb 05 14:36:40 +0000 2018	122227	29614	Any deal on DACA that does not include STRONG border security and the desperately needed WALL is a total waste of t… https://t.co/BuGrQqbWfs
385	Mon Feb 05 12:39:10 +0000 2018	140864	42494	Little Adam Schiff, who is desperate to run for higher office, is one of the biggest liars and leakers in Washingto… https://t.co/7csaXTJLoO
386	Mon Feb 05 12:17:57 +0000 2018	106723	22553	Thank you to @foxandfriends for exposing the truth. Perhaps that’s why your ratings are soooo much better than your untruthful competition!
387	Mon Feb 05 12:11:56 +0000 2018	119958	30324	The Democrats are pushing for Universal HealthCare while thousands of people are marching in the UK because their U… https://t.co/9JK8HHq2bb
388	Mon Feb 05 03:54:42 +0000 2018	210940	35919	Congratulations to the Philadelphia Eagles on a great Super Bowl victory!
389	Sun Feb 04 16:58:14 +0000 2018	140779	22874	My thoughts and prayers are with all of the victims involved in this mornings train collision in South Carolina. Th… https://t.co/H3Ypk1ZwMt
390	Sun Feb 04 00:53:18 +0000 2018	129436	35257	...a tool of anti-Trump political actors. This is unacceptable in a democracy and ought to alarm anyone who wants t… https://t.co/tGnYODCVQx
391	Sun Feb 04 00:40:24 +0000 2018	129347	36357	“The four page memo released Friday reports the disturbing fact about how the FBI and FISA appear to have been used… https://t.co/ZT9YHhTIlA
392	Sun Feb 04 00:26:23 +0000 2018	134788	29745	Great jobs numbers and finally, after many years, rising wages- and nobody even talks about them. Only Russia, Russ… https://t.co/0gYGNuj0BS
393	Sat Feb 03 14:40:27 +0000 2018	140263	38538	This memo totally vindicates “Trump” in probe. But the Russian Witch Hunt goes on and on. Their was no Collusion an… https://t.co/GPYj4JbKgN
394	Sat Feb 03 14:40:23 +0000 2018	155028	34392	Rasmussen just announced that my approval rating jumped to 49%, a far better number than I had in winning the Elect… https://t.co/GbG8u70wTV
395	Sat Feb 03 13:44:19 +0000 2018	0	12573	RT @EricTrump: #MakeAmericaGreatAgain 🇺🇸🇺🇸🇺🇸 https://t.co/CJts3udtNO
396	Sat Feb 03 13:39:49 +0000 2018	0	12174	RT @EricTrump: 🇺🇸🇺🇸🇺🇸 https://t.co/iszxYp036c
397	Fri Feb 02 22:26:22 +0000 2018	70484	14445	Today, it was my honor to join the great men and women of @DHSgov, @CustomsBorder, @ICEgov and @USCIS at the U.S. C… https://t.co/r9EL0AhbO1
398	Fri Feb 02 18:07:08 +0000 2018	77080	17364	“Trump the orator outlines the greatness of America to Democrats’ disgust” https://t.co/XpirrtTY6V
399	Fri Feb 02 18:05:49 +0000 2018	107221	27170	With 3.5 million Americans receiving bonuses or other benefits from their employers as a result of TAX CUTS, 2018 i… https://t.co/cxo1rxdDsj
400	Fri Feb 02 11:49:14 +0000 2018	160385	51544	“You had Hillary Clinton and the Democratic Party try to hide the fact that they gave money to GPS Fusion to create… https://t.co/A8GoOzBrPx
401	Fri Feb 02 11:33:58 +0000 2018	137834	39663	The top Leadership and Investigators of the FBI and the Justice Department have politicized the sacred investigativ… https://t.co/xXWIyOvhi0
402	Fri Feb 02 03:32:48 +0000 2018	123131	28454	The Democrats just aren’t calling about DACA. Nancy Pelosi and Chuck Schumer have to get moving fast, or they’ll di… https://t.co/Tuz4PCoIF4
403	Thu Feb 01 12:02:49 +0000 2018	183078	36742	Thank you for all of the nice compliments and reviews on the State of the Union speech. 45.6 million people watched… https://t.co/HKFLkRjlGQ
404	Thu Feb 01 11:51:43 +0000 2018	122412	29425	March 5th is rapidly approaching and the Democrats are doing nothing about DACA. They Resist, Blame, Complain and O… https://t.co/A4qhFRv21V
405	Thu Feb 01 11:43:17 +0000 2018	136871	28056	Heading to beautiful West Virginia to be with great members of the Republican Party. Will be planning Infrastructur… https://t.co/17g1hxSFRI
406	Wed Jan 31 02:00:02 +0000 2018	108117	21504	"Join me live for the #SOTU
https://t.co/0SLktWxfHi"
407	Mon Jan 29 20:12:39 +0000 2018	83469	15996	Congratulations to America’s new Secretary of @HHSGov, Alex Azar! https://t.co/Y9inQaCt7o
408	Sun Jan 28 13:18:33 +0000 2018	197988	41653	Our economy is better than it has been in many decades. Businesses are coming back to America like never before. Ch… https://t.co/ZrThpTutNr
409	Sun Jan 28 13:18:32 +0000 2018	238107	62909	Somebody please inform Jay-Z that because of my policies, Black Unemployment has just been reported to be at the LOWEST RATE EVER RECORDED!
410	Sun Jan 28 04:08:02 +0000 2018	155854	35289	Democrats are not interested in Border Safety &amp; Security or in the funding and rebuilding of our Military. They are… https://t.co/wM9cL8CBo7
411	Sun Jan 28 03:58:02 +0000 2018	174190	46248	I have offered DACA a wonderful deal, including a doubling in the number of recipients &amp; a twelve year pathway to c… https://t.co/gSxSjiRcoC
412	Sat Jan 27 22:59:52 +0000 2018	113268	21755	Taliban targeted innocent Afghans, brave police in Kabul today. Our thoughts and prayers go to the victims, and fir… https://t.co/nxuDZV0VYZ
413	Sat Jan 27 19:30:24 +0000 2018	107071	25516	On Holocaust Remembrance Day we mourn and grieve the murder of 6 million innocent Jewish men, women and children, a… https://t.co/Df8jIU5KW2
414	Sat Jan 27 11:55:58 +0000 2018	123170	28815	Thank you to Brandon Judd of the National Border Patrol Council for his strong statement on @foxandfriends that we… https://t.co/33QbAoLFxj
415	Fri Jan 26 23:27:23 +0000 2018	71730	16115	Thank you for the wonderful welcome @WEF! #Davos2018 https://t.co/IQkoQJxR5B
416	Fri Jan 26 17:16:44 +0000 2018	118182	25840	DACA has been made increasingly difficult by the fact that Cryin’ Chuck Schumer took such a beating over the shutdo… https://t.co/5faBeqcNP9
417	Fri Jan 26 17:12:32 +0000 2018	111257	22313	Heading back from a very exciting two days in Davos, Switzerland. Speech on America’s economic revival was well rec… https://t.co/JbNNrNVH9z
418	Fri Jan 26 12:54:36 +0000 2018	52031	9979	Join me live at the 2018 World Economic Forum in Davos, Switzerland! #WEF18 https://t.co/fdHejCmv73 https://t.co/DuKJlVTWB8
419	Fri Jan 26 11:23:07 +0000 2018	55459	10641	Great bilateral meeting with President @Alain_Berset of the Swiss Confederation - as we continue to strengthen our… https://t.co/3bK58PuFPd
420	Fri Jan 26 10:46:48 +0000 2018	63221	12350	It was an honor to meet with Republic of Rwanda President Paul Kagame this morning in Davos, Switzerland. Many grea… https://t.co/tiD5NSYYwB
421	Fri Jan 26 10:11:26 +0000 2018	36548	6513	Will be interviewed on  @SquawkCNBC by @JoeSquawk coming up at 6:00amE from Davos, Switzerland. Enjoy! #WEF18 https://t.co/7egYlxnFBd
422	Thu Jan 25 22:38:21 +0000 2018	83442	17541	Today, Americans everywhere remember the brave men and women of @NASA who lost their lives in our Nation’s eternal… https://t.co/KMP2MhJVLS
423	Thu Jan 25 18:03:29 +0000 2018	72495	14969	Very productive bilateral meeting with Prime Minister Benjamin @Netanyahu of Israel - in Davos, Switzerland! #WEF18 https://t.co/2sZM9YI7tJ
424	Thu Jan 25 17:25:53 +0000 2018	75858	15820	Great bilateral meeting with Prime Minister Theresa May of the United Kingdom, affirming the special relationship a… https://t.co/6bIzOEo8DK
425	Thu Jan 25 00:27:00 +0000 2018	151613	28000	Will soon be heading to Davos, Switzerland, to tell the world how great America is and is doing. Our economy is now… https://t.co/OwSYSiCiKe
426	Wed Jan 24 22:51:20 +0000 2018	78736	16626	It was my great honor to welcome Mayor’s from across America to the WH. My Administration will always support local… https://t.co/N7Z9Dw3uIi
427	Wed Jan 24 20:26:16 +0000 2018	98053	19044	Earlier today, I spoke with @GovMattBevin of Kentucky regarding yesterday’s shooting at Marshall County High School… https://t.co/20Bf0p7oFT
428	Wed Jan 24 11:58:58 +0000 2018	146169	32816	Tremendous investment by companies from all over the world being made in America. There has never been anything lik… https://t.co/sUp4LsbXhz
429	Wed Jan 24 04:07:27 +0000 2018	153594	36170	Cryin’ Chuck Schumer fully understands, especially after his humiliating defeat, that if there is no Wall, there is… https://t.co/oaabUSfT9w
430	Wed Jan 24 03:54:22 +0000 2018	126546	31582	Where are the 50,000 important text messages between FBI lovers Lisa Page and Peter Strzok?  Blaming Samsung!
431	Tue Jan 23 14:16:02 +0000 2018	96911	21308	Thank you to General John Kelly, who is doing a fantastic job, and all of the Staff and others in the White House,… https://t.co/q4hhzEEjor
432	Tue Jan 23 13:34:37 +0000 2018	111721	23767	Nobody knows for sure that the Republicans &amp; Democrats will be able to reach a deal on DACA by February 8, but ever… https://t.co/2qBHLtCo1u
433	Tue Jan 23 11:55:42 +0000 2018	133244	36195	In one of the biggest stories in a long time, the FBI now says it is missing five months worth of lovers Strzok-Pag… https://t.co/Zwg2yDeEwz
434	Tue Jan 23 11:31:40 +0000 2018	128126	26898	Even Crazy Jim Acosta of Fake News CNN agrees: “Trump World and WH sources dancing in end zone: Trump wins again...… https://t.co/X4ncbncUqi
435	Tue Jan 23 04:30:33 +0000 2018	132420	27671	Big win for Republicans as Democrats cave on Shutdown. Now I want a big win for everyone, including Republicans, De… https://t.co/jzJKY5vaAz
436	Mon Jan 22 15:13:18 +0000 2018	92266	21352	End the Democrats Obstruction! https://t.co/tzBXilvW1b
437	Mon Jan 22 13:15:55 +0000 2018	108569	21824	Democrats have shut down our government in the interests of their far left base. They don’t want to do it but are powerless!
438	Mon Jan 22 13:07:09 +0000 2018	130926	32841	The Democrats are turning down services and security for citizens in favor of services and security for non-citizens. Not good!
