	date	likes	retweets	text
439	Mon Jan 22 01:21:42 +0000 2018	125770	23327	Thank you to Brad Blakeman on @FoxNews for grading year one of my presidency with an “A”-and likewise to Doug Schoe… https://t.co/RnE8Gh9xnh
440	Sun Jan 21 12:35:28 +0000 2018	176715	46837	Great to see how hard Republicans are fighting for our Military and Safety at the Border. The Dems just want illega… https://t.co/px3zwtzYOV
441	Sun Jan 21 12:20:19 +0000 2018	0	43975	RT @realDonaldTrump: Democrats are holding our Military hostage over their desire to have unchecked illegal immigration. Can’t let that hap…
442	Sun Jan 21 02:34:52 +0000 2018	0	14174	"RT @FoxNews: .@EricTrump: ""My father was elected for one reason, and that's because he actually believes in putting America first, which is…"
443	Sun Jan 21 02:33:09 +0000 2018	0	14343	"RT @FoxNews: .@KellyannePolls: ""Since @POTUS took office, 863,000 new jobs were filled by women. Over half a million American women have en…"
444	Sun Jan 21 02:31:28 +0000 2018	0	12948	"RT @FoxNews: .@davidwebbshow: ""Let's look at the calendar. It's January 20th. DACA expires on March 5th. That means this was a construct of…"
445	Sun Jan 21 02:31:07 +0000 2018	0	7305	"RT @FoxNews: .@EricTrump: ""People have seen a year that's incredible, that's been filled with nothing but the best for our country, America…"
446	Sun Jan 21 02:18:51 +0000 2018	46270	6286	Eric Trump on @JudgeJeanine on @FoxNews now!
447	Sun Jan 21 00:47:40 +0000 2018	153188	31304	The Trump Administration has terminated more UNNECESSARY Regulation, in just twelve months, than any other Administ… https://t.co/SFS1cXtdx5
448	Sun Jan 21 00:40:18 +0000 2018	0	41782	RT @realDonaldTrump: Democrats are far more concerned with Illegal Immigrants than they are with our great Military or Safety at our danger…
449	Sat Jan 20 22:31:27 +0000 2018	129495	28455	Unprecedented success for our Country, in so many ways, since the Election. Record Stock Market, Strong on Military… https://t.co/S9Vev9LI6r
450	Sat Jan 20 18:51:24 +0000 2018	206948	52362	Beautiful weather all over our great country, a perfect day for all Women to March. Get out there now to celebrate… https://t.co/0mof82VUry
451	Sat Jan 20 14:27:54 +0000 2018	166706	43975	Democrats are holding our Military hostage over their desire to have unchecked illegal immigration. Can’t let that happen!
452	Sat Jan 20 11:47:42 +0000 2018	122090	31154	#AMERICA FIRST!
453	Sat Jan 20 11:44:01 +0000 2018	153287	39504	For those asking, the Republicans only have 51 votes in the Senate, and they need 60. That is why we need to win mo… https://t.co/VAQ4O1yYv5
454	Sat Jan 20 11:33:35 +0000 2018	122479	29956	This is the One Year Anniversary of my Presidency and the Democrats wanted to give me a nice present. #DemocratShutdown
455	Sat Jan 20 11:17:10 +0000 2018	143382	41782	Democrats are far more concerned with Illegal Immigrants than they are with our great Military or Safety at our dan… https://t.co/eHAkBL3AjB
456	Sat Jan 20 02:28:56 +0000 2018	116178	30775	Not looking good for our great Military or Safety &amp; Security on the very dangerous Southern Border. Dems want a Shu… https://t.co/Zs62ydrvwQ
457	Fri Jan 19 22:17:53 +0000 2018	64344	12860	Excellent preliminary meeting in Oval with @SenSchumer - working on solutions for Security and our great Military t… https://t.co/EC7lpgkNxk
458	Fri Jan 19 20:53:17 +0000 2018	127704	27454	Just signed 702 Bill to reauthorize foreign intelligence collection. This is NOT the same FISA law that was so wron… https://t.co/20fZau7RFT
459	Fri Jan 19 18:39:50 +0000 2018	95843	24592	Today, I was honored and proud to address the 45th Annual @March_for_Life! You are living witnesses of this year’s… https://t.co/eZL7D5NtYg
460	Fri Jan 19 16:28:29 +0000 2018	49118	15315	“Shutting down the government is a very serious thing. People die, accidents happen. I don’t know how I would vote… https://t.co/UdjOG3Ynvl
461	Fri Jan 19 16:14:05 +0000 2018	43669	8411	".@WhiteHouse Briefing with Director Marc Short and Director Mick Mulvaney...
https://t.co/0O0VsYXmHB"
462	Fri Jan 19 12:04:47 +0000 2018	109689	25556	Government Funding Bill past last night in the House of Representatives. Now Democrats are needed if it is to pass… https://t.co/xK33TIW16o
463	Thu Jan 18 23:39:53 +0000 2018	100881	20024	House of Representatives needs to pass Government Funding Bill tonight. So important for our country - our Military needs it!
464	Thu Jan 18 21:04:36 +0000 2018	102499	25815	AMERICA will once again be a NATION that thinks big, dreams bigger, and always reaches for the stars. YOU are the o… https://t.co/VYcBBrQ3pG
465	Thu Jan 18 20:45:33 +0000 2018	75221	15055	Departing Pittsburgh now, where it was my great honor to stand with our incredible workers, and to show the world t… https://t.co/hig8AOxDFs
466	Thu Jan 18 13:49:11 +0000 2018	89817	21494	A government shutdown will be devastating to our military...something the Dems care very little about!
467	Thu Jan 18 13:37:24 +0000 2018	62069	11877	CHIP should be part of a long term solution, not a 30 Day, or short term, extension!
468	Thu Jan 18 13:16:26 +0000 2018	122610	28697	We need the Wall for the safety and security of our country. We need the Wall to help stop the massive inflow of dr… https://t.co/wlyEE41v2w
469	Thu Jan 18 12:53:17 +0000 2018	84676	16978	Will be going to Pennsylvania today in order to give my total support to RICK SACCONE, running for Congress in a Sp… https://t.co/zPK4tKI6Vp
470	Thu Jan 18 11:25:03 +0000 2018	111012	27690	....The Wall will be paid for, directly or indirectly, or through longer term reimbursement, by Mexico, which has a… https://t.co/J09b17pLIi
471	Thu Jan 18 11:15:25 +0000 2018	93559	21256	The Wall is the Wall, it has never changed or evolved from the first day I conceived of it. Parts will be, of neces… https://t.co/3UJscR3WGL
472	Thu Jan 18 01:11:26 +0000 2018	177214	39301	ISIS is in retreat, our economy is booming, investments and jobs are pouring back into the country, and so much mor… https://t.co/pXV43doqxa
473	Thu Jan 18 01:05:46 +0000 2018	111046	22071	Despite some very corrupt and dishonest media coverage, there are many great reporters I respect and lots of GOOD N… https://t.co/XtmYEpRDAu
474	Thu Jan 18 01:00:05 +0000 2018	110824	40602	"And the FAKE NEWS winners are...
https://t.co/59G6x2f7fD"
475	Wed Jan 17 23:36:44 +0000 2018	67492	15387	Main Street is BACK! Strongest Holiday Sales bump since the Great Recession -- beating forecasts by BILLIONS OF DOL… https://t.co/NzP72Zarmr
476	Wed Jan 17 23:32:58 +0000 2018	98212	24348	During the campaign, I promised to MAKE AMERICA GREAT AGAIN by bringing businesses and jobs back to our country. I… https://t.co/OQ1fA6odh7
477	Wed Jan 17 23:28:30 +0000 2018	91424	24057	I promised that my policies would allow companies like Apple to bring massive amounts of money back to the United S… https://t.co/aWutB2fro3
478	Wed Jan 17 23:19:02 +0000 2018	74447	15328	Today, we witnessed an incredible moment in history – the presentation of Congress’ highest civilian honor to our f… https://t.co/svBhsLy1By
479	Wed Jan 17 13:04:46 +0000 2018	53918	6639	Eric Trump on @foxandfriends  now!
480	Tue Jan 16 23:20:10 +0000 2018	80877	18735	....we need to keep America safe, including moving away from a random chain migration and lottery system, to one th… https://t.co/wMQB8vJ3Cs
481	Tue Jan 16 23:19:39 +0000 2018	98949	25391	New report from DOJ &amp; DHS shows that nearly 3 in 4 individuals convicted of terrorism-related charges are foreign-b… https://t.co/9F2yHphpOi
482	Tue Jan 16 20:17:39 +0000 2018	55546	9820	Today, it was my honor to welcome President Nursultan Nazarbayev of Kazakhstan to the @WhiteHouse! https://t.co/TerYFZViax
483	Tue Jan 16 19:43:32 +0000 2018	73202	19283	“President Donald J. Trump Proclaims January 16, 2018, as Religious Freedom Day” https://t.co/bD3R2dJfyp
484	Tue Jan 16 14:30:00 +0000 2018	112129	27685	Unemployment for Black Americans is the lowest ever recorded. Trump approval ratings with Black Americans has doubl… https://t.co/T5tmchLiz8
485	Tue Jan 16 14:24:40 +0000 2018	72419	16001	“90% of Trump 2017 news coverage was negative” -and much of it contrived!@foxandfriends
486	Tue Jan 16 14:19:46 +0000 2018	110389	25961	Do you notice the Fake News Mainstream Media never likes covering the great and record setting economic news, but r… https://t.co/8kZJQ8SQZe
487	Tue Jan 16 14:07:38 +0000 2018	99300	23474	The Democrats want to shut down the Government over Amnesty for all and Border Security. The biggest loser will be… https://t.co/Kv8aUAd3gD
488	Tue Jan 16 13:54:02 +0000 2018	116361	24603	We must have Security at our VERY DANGEROUS SOUTHERN BORDER, and we must have a great WALL to help protect us, and… https://t.co/QH1uNnvCOq
489	Tue Jan 16 00:55:35 +0000 2018	0	29711	RT @realDonaldTrump: Senator Dicky Durbin totally misrepresented what was said at the DACA meeting. Deals can’t get made when there is no t…
490	Tue Jan 16 00:53:38 +0000 2018	0	27170	RT @realDonaldTrump: DACA is probably dead because the Democrats don’t really want it, they just want to talk and take desperately needed m…
491	Tue Jan 16 00:53:19 +0000 2018	0	38818	RT @realDonaldTrump: I, as President, want people coming into our Country who are going to help us become strong and great again, people co…
492	Tue Jan 16 00:52:48 +0000 2018	0	18825	RT @realDonaldTrump: ...big unnecessary regulation cuts made it all possible” (among many other things). “President Trump reversed the poli…
493	Tue Jan 16 00:52:43 +0000 2018	0	24707	RT @realDonaldTrump: “President Trump is not getting the credit he deserves for the economy. Tax Cut bonuses to more than 2,000,000 workers…
494	Tue Jan 16 00:50:19 +0000 2018	0	13671	RT @EricTrump: I will be always be incredibly proud of my work for @StJude, raising $16.3+ million dollars over the last 10 years at a 9.2%…
495	Tue Jan 16 00:48:04 +0000 2018	0	8795	RT @EricTrump: #MakeAmericaGreatAgain 🇺🇸🇺🇸🇺🇸 https://t.co/b81NtQGhHa
496	Tue Jan 16 00:47:59 +0000 2018	0	2660	RT @Heritage: We had a special visitor yesterday. @IvankaTrump, thank you for meeting with @KayColesJames, spending time with our team, and…
497	Mon Jan 15 20:28:15 +0000 2018	116349	29711	Senator Dicky Durbin totally misrepresented what was said at the DACA meeting. Deals can’t get made when there is n… https://t.co/YaPbD8cjHe
498	Mon Jan 15 16:01:11 +0000 2018	0	21187	"RT @WhiteHouse: ""Dr. King's dream is our dream. It is the American Dream. It's the promise stitched into the fabric of our Nation, etched i…"
499	Mon Jan 15 13:02:22 +0000 2018	112062	23231	...to stop drugs, they want to take money away from our military which we cannot do.” My standard is very simple, A… https://t.co/Q3BJnCHTLv
