	Unnamed: 0	date	likes	retweets	text	filtered_text	polarity	subjectivity
168	168	Mon Feb 05 15:08:51 +0000 2018	133561	35801	Representative Devin Nunes, a man of tremendous courage and grit, may someday be recognized as a Great American Her… https://t.co/p7egMdnqQs	Representative Devin Nunes a man of tremendous courage and grit may someday be recognized as a Great American Her 	0.37777777777777777	0.5833333333333334
169	169	Mon Feb 05 14:36:40 +0000 2018	123216	30024	Any deal on DACA that does not include STRONG border security and the desperately needed WALL is a total waste of t… https://t.co/BuGrQqbWfs	Any deal on DACA that does not include STRONG border security and the desperately needed WALL is a total waste of t 	-0.09166666666666667	0.6208333333333333
170	170	Mon Feb 05 12:39:10 +0000 2018	142217	43176	Little Adam Schiff, who is desperate to run for higher office, is one of the biggest liars and leakers in Washingto… https://t.co/7csaXTJLoO	Little Adam Schiff who is desperate to run for higher office is one of the biggest liars and leakers in Washingto 	-0.17916666666666667	0.6666666666666666
171	171	Mon Feb 05 12:17:57 +0000 2018	107531	22835	Thank you to @foxandfriends for exposing the truth. Perhaps that’s why your ratings are soooo much better than your untruthful competition!	Thank you to foxandfriends for exposing the truth Perhaps thats why your ratings are soooo much better than your untruthful competition	0.5	0.5
172	172	Mon Feb 05 12:11:56 +0000 2018	120860	30737	The Democrats are pushing for Universal HealthCare while thousands of people are marching in the UK because their U… https://t.co/9JK8HHq2bb	The Democrats are pushing for Universal HealthCare while thousands of people are marching in the UK because their U 	0.0	0.0
173	173	Mon Feb 05 03:54:42 +0000 2018	212157	36332	Congratulations to the Philadelphia Eagles on a great Super Bowl victory!	Congratulations to the Philadelphia Eagles on a great Super Bowl victory	0.5666666666666667	0.7083333333333333
174	174	Sun Feb 04 16:58:14 +0000 2018	141749	23145	My thoughts and prayers are with all of the victims involved in this mornings train collision in South Carolina. Th… https://t.co/H3Ypk1ZwMt	My thoughts and prayers are with all of the victims involved in this mornings train collision in South Carolina Th 	0.0	0.0
175	175	Sun Feb 04 00:53:18 +0000 2018	130578	35787	...a tool of anti-Trump political actors. This is unacceptable in a democracy and ought to alarm anyone who wants t… https://t.co/tGnYODCVQx	a tool of antiTrump political actors This is unacceptable in a democracy and ought to alarm anyone who wants t 	0.1	0.1
176	176	Sun Feb 04 00:40:24 +0000 2018	130462	36875	“The four page memo released Friday reports the disturbing fact about how the FBI and FISA appear to have been used… https://t.co/ZT9YHhTIlA	The four page memo released Friday reports the disturbing fact about how the FBI and FISA appear to have been used 	-0.5	0.8
177	177	Sun Feb 04 00:26:23 +0000 2018	135883	30166	Great jobs numbers and finally, after many years, rising wages- and nobody even talks about them. Only Russia, Russ… https://t.co/0gYGNuj0BS	Great jobs numbers and finally after many years rising wages and nobody even talks about them Only Russia Russ 	0.325	0.8125
178	178	Sat Feb 03 14:40:27 +0000 2018	141638	39118	This memo totally vindicates “Trump” in probe. But the Russian Witch Hunt goes on and on. Their was no Collusion an… https://t.co/GPYj4JbKgN	This memo totally vindicates Trump in probe But the Russian Witch Hunt goes on and on Their was no Collusion an 	0.0	0.375
179	179	Sat Feb 03 14:40:23 +0000 2018	156339	34840	Rasmussen just announced that my approval rating jumped to 49%, a far better number than I had in winning the Elect… https://t.co/GbG8u70wTV	Rasmussen just announced that my approval rating jumped to 49 a far better number than I had in winning the Elect 	0.47500000000000003	0.7875
180	180	Sat Feb 03 13:44:19 +0000 2018	0	12715	RT @EricTrump: #MakeAmericaGreatAgain 🇺🇸🇺🇸🇺🇸 https://t.co/CJts3udtNO	RT EricTrump MakeAmericaGreatAgain  	0.0	0.0
181	181	Sat Feb 03 13:39:49 +0000 2018	0	12312	RT @EricTrump: 🇺🇸🇺🇸🇺🇸 https://t.co/iszxYp036c	RT EricTrump  	0.0	0.0
182	182	Fri Feb 02 22:26:22 +0000 2018	70978	14594	Today, it was my honor to join the great men and women of @DHSgov, @CustomsBorder, @ICEgov and @USCIS at the U.S. C… https://t.co/r9EL0AhbO1	Today it was my honor to join the great men and women of DHSgov CustomsBorder ICEgov and USCIS at the US C 	0.8	0.75
183	183	Fri Feb 02 18:07:08 +0000 2018	77633	17605	“Trump the orator outlines the greatness of America to Democrats’ disgust” https://t.co/XpirrtTY6V	Trump the orator outlines the greatness of America to Democrats disgust 	0.0	0.0
184	184	Fri Feb 02 18:05:49 +0000 2018	107997	27520	With 3.5 million Americans receiving bonuses or other benefits from their employers as a result of TAX CUTS, 2018 i… https://t.co/cxo1rxdDsj	With 35 million Americans receiving bonuses or other benefits from their employers as a result of TAX CUTS 2018 i 	-0.125	0.375
185	185	Fri Feb 02 11:49:14 +0000 2018	161569	52047	“You had Hillary Clinton and the Democratic Party try to hide the fact that they gave money to GPS Fusion to create… https://t.co/A8GoOzBrPx	You had Hillary Clinton and the Democratic Party try to hide the fact that they gave money to GPS Fusion to create 	0.0	0.0
186	186	Fri Feb 02 11:33:58 +0000 2018	139057	40257	The top Leadership and Investigators of the FBI and the Justice Department have politicized the sacred investigativ… https://t.co/xXWIyOvhi0	The top Leadership and Investigators of the FBI and the Justice Department have politicized the sacred investigativ 	0.5	0.5
187	187	Fri Feb 02 03:32:48 +0000 2018	124145	28851	The Democrats just aren’t calling about DACA. Nancy Pelosi and Chuck Schumer have to get moving fast, or they’ll di… https://t.co/Tuz4PCoIF4	The Democrats just arent calling about DACA Nancy Pelosi and Chuck Schumer have to get moving fast or theyll di 	0.2	0.6
188	188	Thu Feb 01 12:02:49 +0000 2018	184502	37232	Thank you for all of the nice compliments and reviews on the State of the Union speech. 45.6 million people watched… https://t.co/HKFLkRjlGQ	Thank you for all of the nice compliments and reviews on the State of the Union speech 456 million people watched 	0.6	1.0
189	189	Thu Feb 01 11:51:43 +0000 2018	123316	29829	March 5th is rapidly approaching and the Democrats are doing nothing about DACA. They Resist, Blame, Complain and O… https://t.co/A4qhFRv21V	March 5th is rapidly approaching and the Democrats are doing nothing about DACA They Resist Blame Complain and O 	0.0	0.0
190	190	Thu Feb 01 11:43:17 +0000 2018	137877	28386	Heading to beautiful West Virginia to be with great members of the Republican Party. Will be planning Infrastructur… https://t.co/17g1hxSFRI	Heading to beautiful West Virginia to be with great members of the Republican Party Will be planning Infrastructur 	0.825	0.875
191	191	Wed Jan 31 02:00:02 +0000 2018	108903	21845	"Join me live for the #SOTU
https://t.co/0SLktWxfHi"	Join me live for the SOTU	0.13636363636363635	0.5
192	192	Mon Jan 29 20:12:39 +0000 2018	84106	16257	Congratulations to America’s new Secretary of @HHSGov, Alex Azar! https://t.co/Y9inQaCt7o	Congratulations to Americas new Secretary of HHSGov Alex Azar 	0.13636363636363635	0.45454545454545453
193	193	Sun Jan 28 13:18:33 +0000 2018	199399	42163	Our economy is better than it has been in many decades. Businesses are coming back to America like never before. Ch… https://t.co/ZrThpTutNr	Our economy is better than it has been in many decades Businesses are coming back to America like never before Ch 	0.3333333333333333	0.3333333333333333
194	194	Sun Jan 28 13:18:32 +0000 2018	239939	63799	Somebody please inform Jay-Z that because of my policies, Black Unemployment has just been reported to be at the LOWEST RATE EVER RECORDED!	Somebody please inform JayZ that because of my policies Black Unemployment has just been reported to be at the LOWEST RATE EVER RECORDED	-0.16666666666666666	0.43333333333333335
195	195	Sun Jan 28 04:08:02 +0000 2018	157096	35786	Democrats are not interested in Border Safety &amp; Security or in the funding and rebuilding of our Military. They are… https://t.co/wM9cL8CBo7	Democrats are not interested in Border Safety amp Security or in the funding and rebuilding of our Military They are 	-0.1125	0.3
196	196	Sun Jan 28 03:58:02 +0000 2018	175540	46849	I have offered DACA a wonderful deal, including a doubling in the number of recipients &amp; a twelve year pathway to c… https://t.co/gSxSjiRcoC	I have offered DACA a wonderful deal including a doubling in the number of recipients amp a twelve year pathway to c 	1.0	1.0
197	197	Sat Jan 27 22:59:52 +0000 2018	114137	22030	Taliban targeted innocent Afghans, brave police in Kabul today. Our thoughts and prayers go to the victims, and fir… https://t.co/nxuDZV0VYZ	Taliban targeted innocent Afghans brave police in Kabul today Our thoughts and prayers go to the victims and fir 	0.65	0.85
198	198	Sat Jan 27 19:30:24 +0000 2018	107807	25846	On Holocaust Remembrance Day we mourn and grieve the murder of 6 million innocent Jewish men, women and children, a… https://t.co/Df8jIU5KW2	On Holocaust Remembrance Day we mourn and grieve the murder of 6 million innocent Jewish men women and children a 	0.25	0.35
199	199	Sat Jan 27 11:55:58 +0000 2018	124085	29159	Thank you to Brandon Judd of the National Border Patrol Council for his strong statement on @foxandfriends that we… https://t.co/33QbAoLFxj	Thank you to Brandon Judd of the National Border Patrol Council for his strong statement on foxandfriends that we 	0.4333333333333333	0.7333333333333333
200	200	Fri Jan 26 23:27:23 +0000 2018	72240	16313	Thank you for the wonderful welcome @WEF! #Davos2018 https://t.co/IQkoQJxR5B	Thank you for the wonderful welcome WEF Davos2018 	0.9	0.95
201	201	Fri Jan 26 17:16:44 +0000 2018	119221	26239	DACA has been made increasingly difficult by the fact that Cryin’ Chuck Schumer took such a beating over the shutdo… https://t.co/5faBeqcNP9	DACA has been made increasingly difficult by the fact that Cryin Chuck Schumer took such a beating over the shutdo 	-0.25	0.75
202	202	Fri Jan 26 17:12:32 +0000 2018	112094	22575	Heading back from a very exciting two days in Davos, Switzerland. Speech on America’s economic revival was well rec… https://t.co/JbNNrNVH9z	Heading back from a very exciting two days in Davos Switzerland Speech on Americas economic revival was well rec 	0.19666666666666668	0.39999999999999997
203	203	Fri Jan 26 12:54:36 +0000 2018	52403	10094	Join me live at the 2018 World Economic Forum in Davos, Switzerland! #WEF18 https://t.co/fdHejCmv73 https://t.co/DuKJlVTWB8	Join me live at the 2018 World Economic Forum in Davos Switzerland WEF18  	0.16818181818181818	0.35
204	204	Fri Jan 26 11:23:07 +0000 2018	55850	10741	Great bilateral meeting with President @Alain_Berset of the Swiss Confederation - as we continue to strengthen our… https://t.co/3bK58PuFPd	Great bilateral meeting with President Alain_Berset of the Swiss Confederation  as we continue to strengthen our 	0.8	0.75
205	205	Fri Jan 26 10:46:48 +0000 2018	63665	12464	It was an honor to meet with Republic of Rwanda President Paul Kagame this morning in Davos, Switzerland. Many grea… https://t.co/tiD5NSYYwB	It was an honor to meet with Republic of Rwanda President Paul Kagame this morning in Davos Switzerland Many grea 	0.5	0.5
206	206	Fri Jan 26 10:11:26 +0000 2018	36767	6569	Will be interviewed on  @SquawkCNBC by @JoeSquawk coming up at 6:00amE from Davos, Switzerland. Enjoy! #WEF18 https://t.co/7egYlxnFBd	Will be interviewed on  SquawkCNBC by JoeSquawk coming up at 600amE from Davos Switzerland Enjoy WEF18 	0.4	0.5
207	207	Thu Jan 25 22:38:21 +0000 2018	84054	17738	Today, Americans everywhere remember the brave men and women of @NASA who lost their lives in our Nation’s eternal… https://t.co/KMP2MhJVLS	Today Americans everywhere remember the brave men and women of NASA who lost their lives in our Nations eternal 	0.8	1.0
208	208	Thu Jan 25 18:03:29 +0000 2018	72981	15151	Very productive bilateral meeting with Prime Minister Benjamin @Netanyahu of Israel - in Davos, Switzerland! #WEF18 https://t.co/2sZM9YI7tJ	Very productive bilateral meeting with Prime Minister Benjamin Netanyahu of Israel  in Davos Switzerland WEF18 	0.2	0.3
209	209	Thu Jan 25 17:25:53 +0000 2018	76457	16020	Great bilateral meeting with Prime Minister Theresa May of the United Kingdom, affirming the special relationship a… https://t.co/6bIzOEo8DK	Great bilateral meeting with Prime Minister Theresa May of the United Kingdom affirming the special relationship a 	0.5785714285714286	0.6607142857142857
210	210	Thu Jan 25 00:27:00 +0000 2018	152789	28364	Will soon be heading to Davos, Switzerland, to tell the world how great America is and is doing. Our economy is now… https://t.co/OwSYSiCiKe	Will soon be heading to Davos Switzerland to tell the world how great America is and is doing Our economy is now 	0.8	0.75
211	211	Wed Jan 24 22:51:20 +0000 2018	79336	16811	It was my great honor to welcome Mayor’s from across America to the WH. My Administration will always support local… https://t.co/N7Z9Dw3uIi	It was my great honor to welcome Mayors from across America to the WH My Administration will always support local 	0.5333333333333333	0.5499999999999999
212	212	Wed Jan 24 20:26:16 +0000 2018	98764	19266	Earlier today, I spoke with @GovMattBevin of Kentucky regarding yesterday’s shooting at Marshall County High School… https://t.co/20Bf0p7oFT	Earlier today I spoke with GovMattBevin of Kentucky regarding yesterdays shooting at Marshall County High School 	0.08	0.52
213	213	Wed Jan 24 11:58:58 +0000 2018	147272	33222	Tremendous investment by companies from all over the world being made in America. There has never been anything lik… https://t.co/sUp4LsbXhz	Tremendous investment by companies from all over the world being made in America There has never been anything lik 	0.3333333333333333	1.0
214	214	Wed Jan 24 04:07:27 +0000 2018	154851	36684	Cryin’ Chuck Schumer fully understands, especially after his humiliating defeat, that if there is no Wall, there is… https://t.co/oaabUSfT9w	Cryin Chuck Schumer fully understands especially after his humiliating defeat that if there is no Wall there is 	0.0	1.0
215	215	Wed Jan 24 03:54:22 +0000 2018	127670	32086	Where are the 50,000 important text messages between FBI lovers Lisa Page and Peter Strzok?  Blaming Samsung!	Where are the 50000 important text messages between FBI lovers Lisa Page and Peter Strzok  Blaming Samsung	0.4	1.0
216	216	Tue Jan 23 14:16:02 +0000 2018	97701	21579	Thank you to General John Kelly, who is doing a fantastic job, and all of the Staff and others in the White House,… https://t.co/q4hhzEEjor	Thank you to General John Kelly who is doing a fantastic job and all of the Staff and others in the White House 	0.15000000000000002	0.4666666666666666
217	217	Tue Jan 23 13:34:37 +0000 2018	112675	24068	Nobody knows for sure that the Republicans &amp; Democrats will be able to reach a deal on DACA by February 8, but ever… https://t.co/2qBHLtCo1u	Nobody knows for sure that the Republicans amp Democrats will be able to reach a deal on DACA by February 8 but ever 	0.5	0.7569444444444444
218	218	Tue Jan 23 11:55:42 +0000 2018	134496	36717	In one of the biggest stories in a long time, the FBI now says it is missing five months worth of lovers Strzok-Pag… https://t.co/Zwg2yDeEwz	In one of the biggest stories in a long time the FBI now says it is missing five months worth of lovers StrzokPag 	0.016666666666666663	0.18333333333333335
219	219	Tue Jan 23 11:31:40 +0000 2018	129224	27254	Even Crazy Jim Acosta of Fake News CNN agrees: “Trump World and WH sources dancing in end zone: Trump wins again...… https://t.co/X4ncbncUqi	Even Crazy Jim Acosta of Fake News CNN agrees Trump World and WH sources dancing in end zone Trump wins again 	-0.26666666666666666	0.7000000000000001
220	220	Tue Jan 23 04:30:33 +0000 2018	133466	28052	Big win for Republicans as Democrats cave on Shutdown. Now I want a big win for everyone, including Republicans, De… https://t.co/jzJKY5vaAz	Big win for Republicans as Democrats cave on Shutdown Now I want a big win for everyone including Republicans De 	0.4	0.25
221	221	Mon Jan 22 15:13:18 +0000 2018	93079	21648	End the Democrats Obstruction! https://t.co/tzBXilvW1b	End the Democrats Obstruction 	0.0	0.0
222	222	Mon Jan 22 13:15:55 +0000 2018	109593	22174	Democrats have shut down our government in the interests of their far left base. They don’t want to do it but are powerless!	Democrats have shut down our government in the interests of their far left base They dont want to do it but are powerless	-0.27111111111111114	0.6377777777777778
223	223	Mon Jan 22 13:07:09 +0000 2018	132076	33298	The Democrats are turning down services and security for citizens in favor of services and security for non-citizens. Not good!	The Democrats are turning down services and security for citizens in favor of services and security for noncitizens Not good	-0.25277777777777777	0.44444444444444453
224	224	Mon Jan 22 01:21:42 +0000 2018	126739	23612	Thank you to Brad Blakeman on @FoxNews for grading year one of my presidency with an “A”-and likewise to Doug Schoe… https://t.co/RnE8Gh9xnh	Thank you to Brad Blakeman on FoxNews for grading year one of my presidency with an Aand likewise to Doug Schoe 	0.0	0.0
225	225	Sun Jan 21 12:35:28 +0000 2018	178271	47486	Great to see how hard Republicans are fighting for our Military and Safety at the Border. The Dems just want illega… https://t.co/px3zwtzYOV	Great to see how hard Republicans are fighting for our Military and Safety at the Border The Dems just want illega 	0.1361111111111111	0.46388888888888885
226	226	Sun Jan 21 12:20:19 +0000 2018	0	44602	RT @realDonaldTrump: Democrats are holding our Military hostage over their desire to have unchecked illegal immigration. Can’t let that hap…	RT realDonaldTrump Democrats are holding our Military hostage over their desire to have unchecked illegal immigration Cant let that hap	-0.3	0.3
227	227	Sun Jan 21 02:34:52 +0000 2018	0	14340	"RT @FoxNews: .@EricTrump: ""My father was elected for one reason, and that's because he actually believes in putting America first, which is…"	RT FoxNews EricTrump My father was elected for one reason and thats because he actually believes in putting America first which is	0.125	0.21666666666666667
228	228	Sun Jan 21 02:33:09 +0000 2018	0	14490	"RT @FoxNews: .@KellyannePolls: ""Since @POTUS took office, 863,000 new jobs were filled by women. Over half a million American women have en…"	RT FoxNews KellyannePolls Since POTUS took office 863000 new jobs were filled by women Over half a million American women have en	0.09242424242424244	0.3803030303030303
229	229	Sun Jan 21 02:31:28 +0000 2018	0	13097	"RT @FoxNews: .@davidwebbshow: ""Let's look at the calendar. It's January 20th. DACA expires on March 5th. That means this was a construct of…"	RT FoxNews davidwebbshow Lets look at the calendar Its January 20th DACA expires on March 5th That means this was a construct of	0.0	0.0
230	230	Sun Jan 21 02:31:07 +0000 2018	0	7370	"RT @FoxNews: .@EricTrump: ""People have seen a year that's incredible, that's been filled with nothing but the best for our country, America…"	RT FoxNews EricTrump People have seen a year thats incredible thats been filled with nothing but the best for our country America	0.7666666666666666	0.7000000000000001
231	231	Sun Jan 21 02:18:51 +0000 2018	46623	6352	Eric Trump on @JudgeJeanine on @FoxNews now!	Eric Trump on JudgeJeanine on FoxNews now	0.0	0.0
232	232	Sun Jan 21 00:47:40 +0000 2018	154371	31721	The Trump Administration has terminated more UNNECESSARY Regulation, in just twelve months, than any other Administ… https://t.co/SFS1cXtdx5	The Trump Administration has terminated more UNNECESSARY Regulation in just twelve months than any other Administ 	-0.00833333333333334	0.5916666666666667
233	233	Sun Jan 21 00:40:18 +0000 2018	0	42322	RT @realDonaldTrump: Democrats are far more concerned with Illegal Immigrants than they are with our great Military or Safety at our danger…	RT realDonaldTrump Democrats are far more concerned with Illegal Immigrants than they are with our great Military or Safety at our danger	0.16	0.5700000000000001
234	234	Sat Jan 20 22:31:27 +0000 2018	130441	28847	Unprecedented success for our Country, in so many ways, since the Election. Record Stock Market, Strong on Military… https://t.co/S9Vev9LI6r	Unprecedented success for our Country in so many ways since the Election Record Stock Market Strong on Military 	0.3466666666666666	0.44666666666666666
235	235	Sat Jan 20 18:51:24 +0000 2018	208734	53206	Beautiful weather all over our great country, a perfect day for all Women to March. Get out there now to celebrate… https://t.co/0mof82VUry	Beautiful weather all over our great country a perfect day for all Women to March Get out there now to celebrate 	0.8833333333333333	0.9166666666666666
236	236	Sat Jan 20 14:27:54 +0000 2018	168245	44602	Democrats are holding our Military hostage over their desire to have unchecked illegal immigration. Can’t let that happen!	Democrats are holding our Military hostage over their desire to have unchecked illegal immigration Cant let that happen	-0.3	0.3
237	237	Sat Jan 20 11:47:42 +0000 2018	123197	31641	#AMERICA FIRST!	AMERICA FIRST	0.25	0.3333333333333333
238	238	Sat Jan 20 11:44:01 +0000 2018	154521	39999	For those asking, the Republicans only have 51 votes in the Senate, and they need 60. That is why we need to win mo… https://t.co/VAQ4O1yYv5	For those asking the Republicans only have 51 votes in the Senate and they need 60 That is why we need to win mo 	0.4	0.7
239	239	Sat Jan 20 11:33:35 +0000 2018	123591	30398	This is the One Year Anniversary of my Presidency and the Democrats wanted to give me a nice present. #DemocratShutdown	This is the One Year Anniversary of my Presidency and the Democrats wanted to give me a nice present DemocratShutdown	0.3	0.5
240	240	Sat Jan 20 11:17:10 +0000 2018	144541	42322	Democrats are far more concerned with Illegal Immigrants than they are with our great Military or Safety at our dan… https://t.co/eHAkBL3AjB	Democrats are far more concerned with Illegal Immigrants than they are with our great Military or Safety at our dan 	0.16	0.5700000000000001
241	241	Sat Jan 20 02:28:56 +0000 2018	117140	31201	Not looking good for our great Military or Safety &amp; Security on the very dangerous Southern Border. Dems want a Shu… https://t.co/Zs62ydrvwQ	Not looking good for our great Military or Safety amp Security on the very dangerous Southern Border Dems want a Shu 	0.12399999999999997	0.49000000000000005
242	242	Fri Jan 19 22:17:53 +0000 2018	64794	13023	Excellent preliminary meeting in Oval with @SenSchumer - working on solutions for Security and our great Military t… https://t.co/EC7lpgkNxk	Excellent preliminary meeting in Oval with SenSchumer  working on solutions for Security and our great Military t 	0.5666666666666667	0.6166666666666667
243	243	Fri Jan 19 20:53:17 +0000 2018	128704	27850	Just signed 702 Bill to reauthorize foreign intelligence collection. This is NOT the same FISA law that was so wron… https://t.co/20fZau7RFT	Just signed 702 Bill to reauthorize foreign intelligence collection This is NOT the same FISA law that was so wron 	-0.0625	0.125
244	244	Fri Jan 19 18:39:50 +0000 2018	96518	24884	Today, I was honored and proud to address the 45th Annual @March_for_Life! You are living witnesses of this year’s… https://t.co/eZL7D5NtYg	Today I was honored and proud to address the 45th Annual March_for_Life You are living witnesses of this years 	0.8	1.0
245	245	Fri Jan 19 16:28:29 +0000 2018	49551	15525	“Shutting down the government is a very serious thing. People die, accidents happen. I don’t know how I would vote… https://t.co/UdjOG3Ynvl	Shutting down the government is a very serious thing People die accidents happen I dont know how I would vote 	-0.29444444444444445	0.5777777777777778
246	246	Fri Jan 19 16:14:05 +0000 2018	43996	8507	".@WhiteHouse Briefing with Director Marc Short and Director Mick Mulvaney...
https://t.co/0O0VsYXmHB"	WhiteHouse Briefing with Director Marc Short and Director Mick Mulvaney	0.0	0.3
247	247	Fri Jan 19 12:04:47 +0000 2018	110565	25911	Government Funding Bill past last night in the House of Representatives. Now Democrats are needed if it is to pass… https://t.co/xK33TIW16o	Government Funding Bill past last night in the House of Representatives Now Democrats are needed if it is to pass 	-0.125	0.15833333333333333
248	248	Thu Jan 18 23:39:53 +0000 2018	101699	20274	House of Representatives needs to pass Government Funding Bill tonight. So important for our country - our Military needs it!	House of Representatives needs to pass Government Funding Bill tonight So important for our country  our Military needs it	0.15000000000000002	0.55
249	249	Thu Jan 18 21:04:36 +0000 2018	103236	26070	AMERICA will once again be a NATION that thinks big, dreams bigger, and always reaches for the stars. YOU are the o… https://t.co/VYcBBrQ3pG	AMERICA will once again be a NATION that thinks big dreams bigger and always reaches for the stars YOU are the o 	0.0	0.3
250	250	Thu Jan 18 20:45:33 +0000 2018	75795	15226	Departing Pittsburgh now, where it was my great honor to stand with our incredible workers, and to show the world t… https://t.co/hig8AOxDFs	Departing Pittsburgh now where it was my great honor to stand with our incredible workers and to show the world t 	0.8500000000000001	0.825
